Organisation,Event Class,Code,Name,Inactive,Default,Minimum Interval,Maximum per Day,Multiple,Excluded By,Presence required,Comments
Betreuungsverband LUK Rendsburg,F,FOOD,Food Distribution,true,false,1,3,true,"FOOD-SUHUR,FOOD-IFTAR",false,Person has received food (legacy event type)
Betreuungsverband LUK Rendsburg,F,FOOD-1,Breakfast,false,false,1,1,true,"FOOD-SUHUR,FOOD-IFTAR",false,Person has received breakfast
Betreuungsverband LUK Rendsburg,F,FOOD-2,Lunch,false,false,1,1,true,"FOOD-SUHUR,FOOD-IFTAR",false,Person has received lunch
Betreuungsverband LUK Rendsburg,F,FOOD-3,Supper,false,false,1,1,true,"FOOD-SUHUR,FOOD-IFTAR",false,Person has received supper
Betreuungsverband LUK Rendsburg,F,FOOD-IFTAR,Iftar (Ramadan),true,false,1,1,true,"FOOD,FOOD-1,FOOD-2,FOOD-3",false,Person has participated in iftar
Betreuungsverband LUK Rendsburg,F,FOOD-SUHUR,Suhur (Ramadan),true,false,1,1,true,"FOOD,FOOD-1,FOOD-2,FOOD-4",false,Person has participated in suhur
